{
  "schema": "perfectvoice.clip.v1",
  "clip_id": "11111111-1111-4111-8111-111111111111",
  "display_name": "A001_C001",
  "source_path": "/Volumes/Media/A001_C001.mov",
  "source_in_sample": 1441440,
  "source_out_sample": 2882880,
  "source_sample_rate": 48000,
  "source_channels": 2,
  "audio_stream_index": 0,
  "channel_map": [0, 1],
  "timeline_start_frame": 86400,
  "timeline_end_frame": 86580,
  "timeline_fps": {"num": 24000, "den": 1001},
  "source_fps": {"num": 24000, "den": 1001},
  "output_media_fps": {"num": 24000, "den": 1001},
  "project_sample_rate": 48000,
  "handles_seconds": 0.5,
  "file_duration_seconds": 3600.0
}
